,X.2,X.1,...1,X,PG.ProteinGroups,PG.Genes,short.name,GO,sub.cell,description,GO.ID,ConditionNorm_P_0_1,ConditionNorm_P_0_2,ConditionNorm_P_0_3,ConditionNorm_P_50_1,ConditionNorm_P_50_2,ConditionNorm_P_50_3,median,Log2,logFC,AveExpr,t,P.Value,adj.P.Val,B,mass,neglog.adj.P.Val.,TotalPeptidesOverallInGene,P0_Undetected,P50_Undetected,medians_.ConditionNorm_P_0_1_ConditionNorm_P_0_2_ConditionNorm_P_0_3,medians_.ConditionNorm_P_50_1_ConditionNorm_P_50_2_ConditionNorm_P_50_3,Ratio,Ratio_log2
223,237,352,352,352,Q9Y376,CAB39,CAB39_HUMAN,cytosol [GO:0005829]; extracellular exosome [GO:0070062]; extracellular region [GO:0005576]; ficolin-1-rich granule lumen [GO:1904813]; secretory granule lumen [GO:0034774]; serine/threonine protein kinase complex [GO:1902554]; kinase binding [GO:0019900]; protein kinase activator activity [GO:0030295]; protein serine/threonine kinase activator activity [GO:0043539]; protein serine/threonine kinase activity [GO:0004674]; cell cycle arrest [GO:0007050]; cellular hypotonic response [GO:0071476]; intracellular signal transduction [GO:0035556]; negative regulation of potassium ion transmembrane transport [GO:1901380]; negative regulation of potassium ion transmembrane transporter activity [GO:1901017]; neutrophil degranulation [GO:0043312]; peptidyl-serine phosphorylation [GO:0018105]; positive regulation of peptidyl-threonine phosphorylation [GO:0010800]; positive regulation of protein serine/threonine kinase activity [GO:0071902]; protein heterooligomerization [GO:0051291]; signal transduction by protein phosphorylation [GO:0023014],SUBCELLULAR LOCATION: Cytoplasm {ECO:0000305}.,Calcium-binding protein 39 (MO25alpha) (Protein Mo25),GO:0004674; GO:0005576; GO:0005829; GO:0007050; GO:0010800; GO:0018105; GO:0019900; GO:0023014; GO:0030295; GO:0034774; GO:0035556; GO:0043312; GO:0043539; GO:0051291; GO:0070062; GO:0071476; GO:0071902; GO:1901017; GO:1901380; GO:1902554; GO:1904813,0.00243626511391096,0.00010372558479511,7.14970073260723E-05,0.0357632496210587,0.0408132912610811,0.0526632321887976,0.0408132912610811,-4.6148171328278300,0.0422094284549684,0.0219752101294949,8.62765808539818,0.00071796216469081,0.0174595344595267,-4.25483662682953,39869,1.75796734049037,8,0,0,0.00010372558479511,0.0408132912610811,393.473715686443,8.62012345570992
224,238,353,353,353,P24666,ACP1,PPAC_HUMAN,cytoplasm [GO:0005737]; cytoplasmic side of plasma membrane [GO:0009898]; cytosol [GO:0005829]; extracellular exosome [GO:0070062]; sarcolemma [GO:0042383]; acid phosphatase activity [GO:0003993]; non-membrane spanning protein tyrosine phosphatase activity [GO:0004726],SUBCELLULAR LOCATION: Cytoplasm.,Low molecular weight phosphotyrosine protein phosphatase (LMW-PTP) (LMW-PTPase) (EC 3.1.3.48) (Adipocyte acid phosphatase) (Low molecular weight cytosolic acid phosphatase) (EC 3.1.3.2) (Red cell acid phosphatase 1),GO:0003993; GO:0004726; GO:0005737; GO:0005829; GO:0009898; GO:0042383; GO:0070062,0.00312098367556444,0.0104105615443324,0.0062262711219916,0.0309403228823784,0.0268281193919513,0.033486094343574,0.0309403228823784,-5.0143679374488100,0.0238322400920051,0.018502058826632,8.61165484875245,0.00072344400367345,0.0175430047349711,-4.26412955018352,18042,1.75589601940457,6,0,0,0.0062262711219916,0.0309403228823784,4.96931827672829,2.3130479471109
225,239,354,354,354,Q92558,WASF1,WASF1_HUMAN,actin cytoskeleton [GO:0015629]; cytoskeleton [GO:0005856]; focal adhesion [GO:0005925]; lamellipodium [GO:0030027]; mitochondrial outer membrane [GO:0005741]; protein-containing complex [GO:0032991]; SCAR complex [GO:0031209]; synapse [GO:0045202]; actin binding [GO:0003779]; protein kinase A binding [GO:0051018]; protein-containing complex binding [GO:0044877]; actin filament polymerization [GO:0030041]; cellular response to brain-derived neurotrophic factor stimulus [GO:1990416]; dendrite extension [GO:0097484]; lamellipodium morphogenesis [GO:0072673]; positive regulation of Arp2/3 complex-mediated actin nucleation [GO:2000601]; positive regulation of neurotrophin TRK receptor signaling pathway [GO:0051388]; protein-containing complex assembly [GO:0065003]; Rac protein signal transduction [GO:0016601]; receptor-mediated endocytosis [GO:0006898],"SUBCELLULAR LOCATION: Cytoplasm, cytoskeleton {ECO:0000269|PubMed:9889097}. Cell junction, synapse {ECO:0000250|UniProtKB:Q5BJU7}. Cell junction, focal adhesion {ECO:0000269|PubMed:18559503}. Note=Dot-like pattern in the cytoplasm. Concentrated in Rac-regulated membrane-ruffling areas (PubMed:9889097). Partial translocation to focal adhesion sites might be mediated by interaction with SORBS2 (PubMed:18559503). In neurons, colocalizes with activated NTRK2 after BDNF addition in endocytic sites through the association with TMEM108 (By similarity). {ECO:0000250|UniProtKB:Q8R5H6, ECO:0000269|PubMed:18559503, ECO:0000269|PubMed:9889097}.",Wiskott-Aldrich syndrome protein family member 1 (WASP family protein member 1) (Protein WAVE-1) (Verprolin homology domain-containing protein 1),GO:0003779; GO:0005741; GO:0005856; GO:0005925; GO:0006898; GO:0015629; GO:0016601; GO:0030027; GO:0030041; GO:0031209; GO:0032991; GO:0044877; GO:0045202; GO:0051018; GO:0051388; GO:0065003; GO:0072673; GO:0097484; GO:1990416; GO:2000601,0.00020082065048651,0.00010354759721506,0.00028274572292575,0.0102241419002451,0.014559096321786,0.015324517778437,0.014559096321786,-6.101935379055300,0.0131735473432803,0.00678247832851592,8.59077293939677,0.00073067412312812,0.0176546571791851,-4.27627862351707,61652,1.75314071121523,13,0,0,0.00020082065048651,0.014559096321786,72.4980039976715,6.17986937053492
226,240,355,355,355,Q9UP83,COG5,COG5_HUMAN,cytosol [GO:0005829]; Golgi apparatus [GO:0005794]; Golgi membrane [GO:0000139]; Golgi transport complex [GO:0017119]; membrane [GO:0016020]; nucleoplasm [GO:0005654]; trans-Golgi network membrane [GO:0032588]; ER to Golgi vesicle-mediated transport [GO:0006888]; intra-Golgi vesicle-mediated transport [GO:0006891]; protein transport [GO:0015031],"SUBCELLULAR LOCATION: Cytoplasm, cytosol {ECO:0000269|PubMed:9792665}. Golgi apparatus membrane {ECO:0000269|PubMed:9792665}; Peripheral membrane protein {ECO:0000269|PubMed:9792665}.",Conserved oligomeric Golgi complex subunit 5 (COG complex subunit 5) (13S Golgi transport complex 90 kDa subunit) (GTC-90) (Component of oligomeric Golgi complex 5) (Golgi transport complex 1),GO:0000139; GO:0005654; GO:0005794; GO:0005829; GO:0006888; GO:0006891; GO:0015031; GO:0016020; GO:0017119; GO:0032588,0.00218074380435772,0.00092906913508571,0.00187072937414643,0.00697598254087708,0.00560444593095452,0.00690207699573185,0.00690207699573185,-7.17875371689548000,0.0048339877179912,0.00407717463019222,8.58647468313227,0.00073217328254798,0.0176546571791851,-4.27878260649367,92743,1.75314071121523,5,0,0,0.00187072937414643,0.00690207699573185,3.68951120943461,1.88342969909492
227,241,356,356,356,Q9Y4F3,MARF1,MARF1_HUMAN,Golgi apparatus [GO:0005794]; intracellular membrane-bounded organelle [GO:0043231]; membrane [GO:0016020]; peroxisome [GO:0005777]; RNA binding [GO:0003723]; double-strand break repair [GO:0006302]; female meiotic nuclear division [GO:0007143]; negative regulation of phosphatase activity [GO:0010923]; oogenesis [GO:0048477]; regulation of gene expression [GO:0010468],SUBCELLULAR LOCATION: Peroxisome {ECO:0000269|PubMed:15932519}.,Meiosis regulator and mRNA stability factor 1 (Limkain-b1) (Meiosis arrest female protein 1),GO:0003723; GO:0005777; GO:0005794; GO:0006302; GO:0007143; GO:0010468; GO:0010923; GO:0016020; GO:0043231; GO:0048477,8.96053813091854E-05,8.20247336842061E-05,0.0001039436283023,0.0452633435284153,0.0640093105561659,0.0686750123971565,0.0640093105561659,-3.9655744203456000,0.059224030912814,0.0297038733708389,8.57773597263952,0.0007352328007467,0.0176617170575026,-4.28387685204654,192859,1.75296707695614,7,0,0,8.96053813091854E-05,0.0640093105561659,714.34672361139,9.48048067722188
228,242,359,359,359,O94868,FCHSD2,FCSD2_HUMAN,neuromuscular junction [GO:0031594]; recycling endosome [GO:0055037]; neuromuscular synaptic transmission [GO:0007274]; regulation of actin filament polymerization [GO:0030833],NA,F-BAR and double SH3 domains protein 2 (Carom) (SH3 multiple domains protein 3),GO:0007274; GO:0030833; GO:0031594; GO:0055037,0.0146050506055466,0.0226051480162605,0.0427280569112259,0.11936283191233,0.136585945385762,0.155733504761162,0.136585945385762,-2.872119056101590,0.110581342175407,0.0819367562653813,8.53268236535053,0.00075125670799142,0.0179129733158958,-4.31021440149434,84276,1.74683232104591,6,0,0,0.0226051480162605,0.136585945385762,6.0422495480902,2.59508576936171
229,243,360,360,360,Q8WUN7,UBTD2,UBTD2_HUMAN,cytoplasm [GO:0005737],SUBCELLULAR LOCATION: Cytoplasm {ECO:0000269|PubMed:12507522}.,Ubiquitin domain-containing protein 2 (Dendritic cell-derived ubiquitin-like protein) (DC-UbP) (Ubiquitin-like protein SB72),GO:0005737,0.00140937837214967,0.0009917994851343,0.0599098906287866,0.232721989017393,0.208501793800348,0.19047744353051,0.208501793800348,-2.261868299247480,0.189796719287394,0.11566871580572,8.52029219199704,0.0007557380228829,0.017967113691887,-4.31747915006664,26190,1.74552168406884,3,0,0,0.00140937837214967,0.208501793800348,147.938834539037,7.20885700517765
230,244,361,361,361,Q16706,MAN2A1,MA2A1_HUMAN,"cis-Golgi network [GO:0005801]; extracellular exosome [GO:0070062]; Golgi medial cisterna [GO:0005797]; Golgi membrane [GO:0000139]; integral component of membrane [GO:0016021]; membrane [GO:0016020]; alpha-mannosidase activity [GO:0004559]; carbohydrate binding [GO:0030246]; hydrolase activity, hydrolyzing N-glycosyl compounds [GO:0016799]; mannosyl-oligosaccharide 1,3-1,6-alpha-mannosidase activity [GO:0004572]; metal ion binding [GO:0046872]; in utero embryonic development [GO:0001701]; liver development [GO:0001889]; lung alveolus development [GO:0048286]; mannose metabolic process [GO:0006013]; mitochondrion organization [GO:0007005]; N-glycan processing [GO:0006491]; positive regulation of neurogenesis [GO:0050769]; protein deglycosylation [GO:0006517]; protein glycosylation [GO:0006486]; respiratory gaseous exchange [GO:0007585]; retina morphogenesis in camera-type eye [GO:0060042]; vacuole organization [GO:0007033]",SUBCELLULAR LOCATION: Golgi apparatus membrane {ECO:0000250|UniProtKB:P28494}; Single-pass type II membrane protein {ECO:0000250|UniProtKB:P28494}.,"Alpha-mannosidase 2 (EC 3.2.1.114) (Golgi alpha-mannosidase II) (AMan II) (Man II) (Mannosidase alpha class 2A member 1) (Mannosyl-oligosaccharide 1,3-1,6-alpha-mannosidase)",GO:0000139; GO:0001701; GO:0001889; GO:0004559; GO:0004572; GO:0005797; GO:0005801; GO:0006013; GO:0006486; GO:0006491; GO:0006517; GO:0007005; GO:0007033; GO:0007585; GO:0016020; GO:0016021; GO:0016799; GO:0030246; GO:0046872; GO:0048286; GO:0050769; GO:0060042; GO:0070062,0.0609360913753971,0.0574342724171181,0.065901299279838,0.271263741156324,0.228415530946693,0.199838075584406,0.228415530946693,-2.130267345859100,0.171748561538356,0.147298168459963,8.51482652253598,0.00075772523864149,0.017967113691887,-4.32068682761053,131141,1.74552168406884,3,0,0,0.0609360913753971,0.228415530946693,3.74844407954455,1.90629187973267
231,245,362,362,362,Q15126,PMVK,PMVK_HUMAN,"cytosol [GO:0005829]; extracellular exosome [GO:0070062]; membrane [GO:0016020]; peroxisome [GO:0005777]; ATP binding [GO:0005524]; phosphomevalonate kinase activity [GO:0004631]; cholesterol biosynthetic process [GO:0006695]; isopentenyl diphosphate biosynthetic process, mevalonate pathway [GO:0019287]; regulation of cholesterol biosynthetic process [GO:0045540]; response to cholesterol [GO:0070723]; sterol biosynthetic process [GO:0016126]","SUBCELLULAR LOCATION: Cytoplasm, cytosol {ECO:0000269|PubMed:10191291, ECO:0000269|PubMed:27052676}.",Phosphomevalonate kinase (PMKase) (hPMK) (EC 2.7.4.2),GO:0004631; GO:0005524; GO:0005777; GO:0005829; GO:0006695; GO:0016020; GO:0016126; GO:0019287; GO:0045540; GO:0070062; GO:0070723,1E-07,1E-07,0.00019012467848525,0.0179140979733034,0.0275515462958663,0.0237172853798193,0.0237172853798193,-5.3979172976476700,0.022997534990168,0.0115622090545791,8.50408358214307,0.00076164980744879,0.0180102827396732,-4.32699694894298,21995,1.74447946922844,4,2,0,1E-07,0.0237172853798193,237172.853798193,17.8555793665639
232,246,364,364,364,Q16555,DPYSL2,DPYL2_HUMAN,cytoskeleton [GO:0005856]; cytosol [GO:0005829]; extracellular exosome [GO:0070062]; plasma membrane [GO:0005886]; dihydropyrimidinase activity [GO:0004157]; identical protein binding [GO:0042802]; microtubule binding [GO:0008017]; axon guidance [GO:0007411]; brain development [GO:0007420]; cytoskeleton organization [GO:0007010]; endocytosis [GO:0006897]; nervous system development [GO:0007399]; nucleobase-containing compound metabolic process [GO:0006139]; regulation of axon extension [GO:0030516]; signal transduction [GO:0007165],"SUBCELLULAR LOCATION: Cytoplasm, cytosol {ECO:0000269|PubMed:20801876}. Cytoplasm, cytoskeleton {ECO:0000269|PubMed:20801876}. Membrane {ECO:0000269|PubMed:20801876}. Note=Tightly but non-covalently associated with membranes.",Dihydropyrimidinase-related protein 2 (DRP-2) (Collapsin response mediator protein 2) (CRMP-2) (N2A3) (Unc-33-like phosphoprotein 2) (ULIP-2),GO:0004157; GO:0005829; GO:0005856; GO:0005886; GO:0006139; GO:0006897; GO:0007010; GO:0007165; GO:0007399; GO:0007411; GO:0007420; GO:0008017; GO:0030516; GO:0042802; GO:0070062,1E-07,0.0001655349178798,4.67960907035E-05,0.00164086337876987,0.00239964386310071,0.00185844048079829,0.00185844048079829,-9.07169180008477000,0.00189550557136186,0.00101856312187536,8.48269150787764,0.00076953888794265,0.0180554022974489,-4.33958319763035,62294,1.743392830493,28,1,0,4.67960907035E-05,0.00185844048079829,39.7135840378926,5.31156066074515
233,247,365,365,365,Q16718,NDUFA5,NDUA5_HUMAN,"mitochondrial inner membrane [GO:0005743]; mitochondrial respiratory chain complex I [GO:0005747]; NADH dehydrogenase (ubiquinone) activity [GO:0008137]; mitochondrial electron transport, NADH to ubiquinone [GO:0006120]; mitochondrial respiratory chain complex I assembly [GO:0032981]",SUBCELLULAR LOCATION: Mitochondrion inner membrane {ECO:0000305|PubMed:12611891}; Peripheral membrane protein {ECO:0000305}; Matrix side {ECO:0000305}.,NADH dehydrogenase [ubiquinone] 1 alpha subcomplex subunit 5 (Complex I subunit B13) (Complex I-13kD-B) (CI-13kD-B) (NADH-ubiquinone oxidoreductase 13 kDa-B subunit),GO:0005743; GO:0005747; GO:0006120; GO:0008137; GO:0032981,0.0148175377925867,0.0188069776364817,0.0174913455327015,0.0683590877608932,0.0583192899555012,0.0510419141365518,0.0583192899555012,-4.0998830349917900,0.0422014769637254,0.0381393588024527,8.48175716557805,0.00076988572880477,0.0180554022974489,-4.34013356943728,13459,1.743392830493,4,0,0,0.0174913455327015,0.0583192899555012,3.33417974314603,1.73733188103566
234,248,367,367,367,Q9BRD0,BUD13,BUD13_HUMAN,"nucleus [GO:0005634]; RES complex [GO:0070274]; RNA binding [GO:0003723]; mRNA splicing, via spliceosome [GO:0000398]",NA,BUD13 homolog,GO:0000398; GO:0003723; GO:0005634; GO:0070274,0.0278791161533569,0.0304006265735806,0.0140187216522198,0.0721853953917298,0.0873561846090557,0.0780055412832431,0.0780055412832431,-3.6802795773652300,0.0550828856349571,0.0516409309438643,8.46512314426878,0.00077609258611539,0.0181017780303754,-4.34994080874081,70521,1.74227876486255,5,0,0,0.0278791161533569,0.0780055412832431,2.79799190383769,1.48439178798154
235,249,368,368,368,Q12797,ASPH,ASPH_HUMAN,"calcium channel complex [GO:0034704]; cell [GO:0005623]; cortical endoplasmic reticulum [GO:0032541]; endoplasmic reticulum [GO:0005783]; endoplasmic reticulum membrane [GO:0005789]; integral component of endoplasmic reticulum membrane [GO:0030176]; integral component of membrane [GO:0016021]; junctional sarcoplasmic reticulum membrane [GO:0014701]; plasma membrane [GO:0005886]; sarcoplasmic reticulum lumen [GO:0033018]; sarcoplasmic reticulum membrane [GO:0033017]; calcium ion binding [GO:0005509]; electron transfer activity [GO:0009055]; ion channel binding [GO:0044325]; peptide-aspartate beta-dioxygenase activity [GO:0004597]; structural constituent of muscle [GO:0008307]; structural molecule activity [GO:0005198]; activation of cysteine-type endopeptidase activity [GO:0097202]; activation of store-operated calcium channel activity [GO:0032237]; calcium ion transmembrane transport [GO:0070588]; cellular response to calcium ion [GO:0071277]; detection of calcium ion [GO:0005513]; face morphogenesis [GO:0060325]; ion transmembrane transport [GO:0034220]; limb morphogenesis [GO:0035108]; muscle contraction [GO:0006936]; negative regulation of cell proliferation [GO:0008285]; pattern specification process [GO:0007389]; peptidyl-aspartic acid hydroxylation [GO:0042264]; positive regulation of calcium ion transport into cytosol [GO:0010524]; positive regulation of intracellular protein transport [GO:0090316]; positive regulation of proteolysis [GO:0045862]; positive regulation of ryanodine-sensitive calcium-release channel activity [GO:0060316]; positive regulation of transcription, DNA-templated [GO:0045893]; regulation of cardiac conduction [GO:1903779]; regulation of cardiac muscle contraction by regulation of the release of sequestered calcium ion [GO:0010881]; regulation of cell communication by electrical coupling [GO:0010649]; regulation of inositol 1,4,5-trisphosphate-sensitive calcium-release channel activity [GO:0031585]; regulation of protein depolymerization [GO:1901879]; regulation of protein stability [GO:0031647]; regulation of release of sequestered calcium ion into cytosol by sarcoplasmic reticulum [GO:0010880]; regulation of ryanodine-sensitive calcium-release channel activity [GO:0060314]; response to ATP [GO:0033198]; roof of mouth development [GO:0060021]",SUBCELLULAR LOCATION: Isoform 1: Endoplasmic reticulum membrane; Single-pass type II membrane protein {ECO:0000250|UniProtKB:Q28056}.; SUBCELLULAR LOCATION: Isoform 4: Sarcoplasmic reticulum membrane; Single-pass type II membrane protein {ECO:0000305|PubMed:15485681}.; SUBCELLULAR LOCATION: Isoform 8: Endoplasmic reticulum membrane; Single-pass type II membrane protein {ECO:0000269|PubMed:22586105}.,Aspartyl/asparaginyl beta-hydroxylase (EC 1.14.11.16) (Aspartate beta-hydroxylase) (ASP beta-hydroxylase) (Peptide-aspartate beta-dioxygenase),GO:0004597; GO:0005198; GO:0005509; GO:0005513; GO:0005623; GO:0005783; GO:0005789; GO:0005886; GO:0006936; GO:0007389; GO:0008285; GO:0008307; GO:0009055; GO:0010524; GO:0010649; GO:0010880; GO:0010881; GO:0014701; GO:0016021; GO:0030176; GO:0031585; GO:0031647; GO:0032237; GO:0032541; GO:0033017; GO:0033018; GO:0033198; GO:0034220; GO:0034704; GO:0035108; GO:0042264; GO:0044325; GO:0045862; GO:0045893; GO:0060021; GO:0060314; GO:0060316; GO:0060325; GO:0070588; GO:0071277; GO:0090316; GO:0097202; GO:1901879; GO:1903779,0.0839937799412359,0.0741895685486715,0.0755883500932516,0.248880723944016,0.241959956740786,0.191501127277089,0.241959956740786,-2.047159787022110,0.149523369792911,0.152685584424175,8.44734596858606,0.00078279370249333,0.0181915865578648,-4.36044095191019,85863,1.74012942280136,7,0,0,0.0755883500932516,0.241959956740786,3.20102180352244,1.67853250372716
236,250,369,369,369,Q86VW0,SESTD1,SESD1_HUMAN,"intermediate filament cytoskeleton [GO:0045111]; phosphatidic acid binding [GO:0070300]; phosphatidylinositol-3,4-bisphosphate binding [GO:0043325]; phosphatidylinositol-3,5-bisphosphate binding [GO:0080025]; phosphatidylinositol-3-phosphate binding [GO:0032266]; phosphatidylinositol-4,5-bisphosphate binding [GO:0005546]; phosphatidylinositol-4-phosphate binding [GO:0070273]; phosphatidylinositol-5-phosphate binding [GO:0010314]; negative regulation of calcium ion transmembrane transport via high voltage-gated calcium channel [GO:1904878]",NA,SEC14 domain and spectrin repeat-containing protein 1 (Huntingtin-interacting protein-like protein) (Protein Solo),GO:0005546; GO:0010314; GO:0032266; GO:0043325; GO:0045111; GO:0070273; GO:0070300; GO:0080025; GO:1904878,0.00281121707361476,0.0123464728589939,0.0031834373703855,0.0676705478090377,0.0525871836131565,0.0746705129633533,0.0676705478090377,-3.8853281222235000,0.0588623723608511,0.0355448952814236,8.44365623653358,0.00078419339250608,0.0181915865578648,-4.36262275825662,79348,1.74012942280136,13,0,0,0.0031834373703855,0.0676705478090377,21.2570689904426,4.40987078091608
237,252,371,371,371,O94953,KDM4B,KDM4B_HUMAN,"nucleoplasm [GO:0005654]; histone demethylase activity [GO:0032452]; histone demethylase activity (H3-K36 specific) [GO:0051864]; histone demethylase activity (H3-K9 specific) [GO:0032454]; metal ion binding [GO:0046872]; histone H3-K36 demethylation [GO:0070544]; histone H3-K9 demethylation [GO:0033169]; regulation of transcription, DNA-templated [GO:0006355]; transcription, DNA-templated [GO:0006351]","SUBCELLULAR LOCATION: Nucleus {ECO:0000255|PROSITE-ProRule:PRU00537, ECO:0000269|PubMed:15927959}.",Lysine-specific demethylase 4B (EC 1.14.11.-) (JmjC domain-containing histone demethylation protein 3B) (Jumonji domain-containing protein 2B),GO:0005654; GO:0006351; GO:0006355; GO:0032452; GO:0032454; GO:0033169; GO:0046872; GO:0051864; GO:0070544,3.64620111503343E-05,2.89017174544432E-05,3.96236606926757E-05,0.0848794136462142,0.0556867708672215,0.0668068582004959,0.0668068582004959,-3.9038599765369600,0.069089351774878,0.0345796716838715,8.41583963799677,0.00079484452111379,0.0183392698132995,-4.3790984728605,121897,1.73661795996195,8,0,0,3.64620111503343E-05,0.0668068582004959,1832.23185153031,10.8393863589969
238,253,372,372,372,P36954,POLR2I,RPB9_HUMAN,"DNA-directed RNA polymerase II, core complex [GO:0005665]; nucleolus [GO:0005730]; nucleoplasm [GO:0005654]; nucleus [GO:0005634]; DNA-directed 5'-3' RNA polymerase activity [GO:0003899]; nucleic acid binding [GO:0003676]; zinc ion binding [GO:0008270]; 7-methylguanosine mRNA capping [GO:0006370]; fibroblast growth factor receptor signaling pathway [GO:0008543]; maintenance of transcriptional fidelity during DNA-templated transcription elongation from RNA polymerase II promoter [GO:0001193]; mRNA cleavage [GO:0006379]; mRNA splicing, via spliceosome [GO:0000398]; regulation of gene silencing by miRNA [GO:0060964]; RNA metabolic process [GO:0016070]; snRNA transcription by RNA polymerase II [GO:0042795]; transcription by RNA polymerase II [GO:0006366]; transcription elongation from RNA polymerase II promoter [GO:0006368]; transcription initiation from RNA polymerase II promoter [GO:0006367]; transcription-coupled nucleotide-excision repair [GO:0006283]","SUBCELLULAR LOCATION: Nucleus, nucleolus {ECO:0000269|PubMed:9852112}.",DNA-directed RNA polymerase II subunit RPB9 (RNA polymerase II subunit B9) (DNA-directed RNA polymerase II subunit I) (RNA polymerase II 14.5 kDa subunit) (RPB14.5),GO:0000398; GO:0001193; GO:0003676; GO:0003899; GO:0005634; GO:0005654; GO:0005665; GO:0005730; GO:0006283; GO:0006366; GO:0006367; GO:0006368; GO:0006370; GO:0006379; GO:0008270; GO:0008543; GO:0016070; GO:0042795; GO:0060964,0.00126121323641072,0.00062122665718834,0.00326499115263095,0.0289623419052227,0.0389352854599895,0.0273813241551908,0.0289623419052227,-5.1096779258050000,0.0300438401580577,0.0167377304277722,8.40605581143348,0.0007986327491363,0.0183771406790505,-4.38490488207474,14523,1.73572206008326,3,0,0,0.00126121323641072,0.0289623419052227,22.9638740453173,4.52129414258469
239,254,373,373,373,Q8NFP4,MDGA1,MDGA1_HUMAN,anchored component of plasma membrane [GO:0046658]; extracellular region [GO:0005576]; extracellular space [GO:0005615]; plasma membrane [GO:0005886]; brain development [GO:0007420]; neuron migration [GO:0001764]; spinal cord association neuron differentiation [GO:0021527],"SUBCELLULAR LOCATION: Cell membrane {ECO:0000269|PubMed:15922729}; Lipid-anchor, GPI-anchor {ECO:0000269|PubMed:15922729}. Note=Associated with lipid rafts.",MAM domain-containing glycosylphosphatidylinositol anchor protein 1 (GPI and MAM protein) (GPIM) (Glycosylphosphatidylinositol-MAM) (MAM domain-containing protein 3),GO:0001764; GO:0005576; GO:0005615; GO:0005886; GO:0007420; GO:0021527; GO:0046658,5.67772885844096E-05,6.78960913219683E-05,8.32366234636109E-05,0.0161879514884989,0.0107673170616976,0.0123322334437978,0.0123322334437978,-6.3414220853709300,0.0130265306635414,0.00658256866622738,8.37952623784343,0.00080901631336196,0.0185303821599329,-4.40067955193946,105790,1.73211562394939,19,0,0,6.78960913219683E-05,0.0123322334437978,181.633923303735,7.50488986603513
